{"formatVersion":1,"goatAbiVersion":1,"mainHash":"1111111111111111111111111111111111111111111111111111111111111111","module":"native-example","specializations":[{"functionId":1,"signature":{"arguments":["integer","integer"],"id":"goat.adapter.v1","result":"integer"},"specializationId":1,"symbol":"goat_fn_1_v1","when":{"argumentTypes":["integer","integer"],"conditions":[{"argument":1,"constant":{"type":"integer","value":0},"operation":"notEqual"}]}}],"target":{"architecture":"x86_64","bits":64,"cpuFeatures":["sse2"],"endian":"little","minimumOs":[5,4],"os":"linux","runtime":{"family":"glibc","minimumVersion":[2,28]}},"version":"1.0"}
